题目T1,作者A1,地址AD,年份YR
国内馆藏资源可视化研究进展分析,吕红;邱均平;李小涛;余厚强;,武汉大学信息管理学院;武汉大学中国科学评价研究中心;,2014
基于Web挖掘的数字图书馆个性化服务体系研究,王玉珍;,兰州商学院信息工程学院;,2014
近10年我国信息可视化研究的计量分析,赵蓉英;郭月培;,武汉大学信息资源研究中心;武汉大学信息管理学院;,2014
国内外图书情报学研究主题的知识图谱比较研究,向剑勤;赵蓉英;,东莞职业技术学院图书馆;武汉大学信息管理学院;,2014
改进的k-means聚类算法在客户细分中的应用研究,杜巍;赵春荣;黄伟建;,河北工程大学信息与电气工程学院;,2014
基于形态分析法的创新导图构建及应用研究,汪雪锋;李兵;许幸荣;杨帆;,北京理工大学管理与经济学院;,2014
随机森林模型在财务失败预警中的应用,孟杰;,天津财经大学理工学院;,2014
基于文献计量的铝矿科技发展态势分析,王立伟;郑军卫;赵纪东;刘学;,中国科学院资源环境科学信息中心/中国科学院国家科学图书馆兰州分馆;,2014
基于Innography的零反式脂肪酸食品专利情报研究,张群;张柏秋;,江南大学图书馆;吉林大学图书馆;,2014
学生能力大规模国际测评项目在教育效能研究中的应用,埃克哈德·克里默;胡咏梅;彭湃;,德国国际教育研究所教育质量与评估中心;德国法兰克福大学教育学院;北京师范大学教育学部、中国基础教育质量监测协同创新中心;华中科技大学教育科学研究院;,2014
财务会计专业课程相关性研究,宋小敏;张国防;袁放建;,西安培华学院;陕西师范大学;,2014
基于教育数据挖掘的大学生学习成果分析,舒忠梅;屈琼斐;,中山大学教育学院;,2014
基于商业智能构建高校教育管理平台的实践探讨,舒忠梅;屈琼斐;郭清顺;,中山大学教育学院;中山大学科技发展研究院;,2014
基于性能分析的兴奋剂判定策略研究,马国全;杨建文;张胜林;郑慧芳;,兰州理工大学体育教学研究部;兰州城市学院体育学院;,2014
基于SCI-E的通信信息业官产学创新合作关系研究,胡春;高玉琨;吴洪;,北京邮电大学经济管理学院;,2014
智慧城市建设中公共数据库构建的思考,陆中骞;,东南大学软件学院;,2014
网络论坛视角下突发事件舆情的关键节点识别及分类研究,曹学艳;段飞飞;方宽;张仙;李仕明;,电子科技大学图书馆;电子科技大学政治与公共管理学院;电子科技大学计算机学院;电子科技大学离退休工作处;电子科技大学经济与管理学院;,2014
高新技术企业创业决策动态信息挖掘分析应用——基于竞争对手情报及期权价值博弈理论,宁方伟;冯俊文;,南京理工大学经济管理学院;,2014
商业银行网络银行业务发展影响因素的实证研究,牟胜东;田益祥;,电子科技大学经济与管理学院;,2014
网络环境下我国虚拟会展平台方案设计研究,焦微玲;裴雷;,盐城工学院经济与管理学院;南京大学信息管理学院;,2014
基于PDCA循环的审计数据分析,柳巧玲;黄作明;丛秋实;,南京审计学院信息科学学院;,2014
基于网络学习平台的竞赛系统设计与应用——天津市教委“博学乐园”学习平台演绎“写字课进课堂”,张宝君;张晶;丁树峰;,天津市电化教育馆;天津市广播电视大学;,2014
在线学习行为分析建模及挖掘,胡艺龄;顾小清;赵春荣1;,华东师范大学教育信息技术学系;华东师范大学信息化办公室;,2014
学习分析视域下的大学生满意度教育数据挖掘及分析,舒忠梅;徐晓东;,中山大学教育学院;华南师范大学教育信息技术学院;,2014
基于计量视角的国内情报学发展动向分析,吕红;邱均平;,武汉大学中国科学评价研究中心;武汉大学信息管理学院;,2014
美国明尼苏达大学图书馆服务价值评估研究及启示,王璐1;,河南职业技术学院图书馆;,2014
聚类视角下图书馆OPAC资源揭示与推送服务探析,邱均平;周毅;,武汉大学信息管理学院;武汉大学科学评价研究中心;,2014
个人数字遗产的概念、管理与对策,蒋银;吴倩;,苏州大学社会学院;,2014
现代企业中商务智能与知识管理的整合,薛云;,北京联合大学商务学院;,2014
关联规则挖掘算法在股票预测中的应用研究——基于遗传网络规划的方法,陈艳1;褚光磊;,上海财经大学统计与管理学院;,2014
第三方资产管理平台发展状况与商业银行的对策,贺本岚;黄旭;韩斯玥;,中国科学院大学博士后流动站;中国工商银行博士后工作站;中国工商银行城市金融研究所;,2014
中美在石墨烯领域的研究轨迹及政策建议,胡光元;唐莉;刘云;,上海财经大学公共经济与管理学院;北京理工大学管理与经济学院;,2014
网上商业数据保护立法研究,王林;杨坚争;,上海理工大学;,2014
改进的SPRINT算法及其在体质数据分析中的应用,丁亚芝;郑志高;马嵘;,新疆师范大学运动人体科学重点实验室;新疆师范大学体育学院;北京大学软件与微电子学院;,2014
数字化时代学生图书馆访问行为与学习绩效的关系,刘欢;卢蓓蓉;任友群1;,华东师范大学信息化办公室;上海数字化教育装备工程技术研究中心;华东师范大学课程与教学研究所;,2014
基于序列模式挖掘的图书馆用户借阅行为分析,付沙;,湖南财政经济学院;武汉大学信息管理学院;,2014
面向供应链的产品评论中客户关注特征挖掘方法研究,郝玫;王道平;,北京科技大学东凌经济管理学院;,2014
基于微信公众平台的图书馆信息推送研究,康思本;,广东理工职业学院图书馆;,2014
基于聚类可增量更新的知识地图管理模型,马晓军;,许昌学院图书馆;,2014
基于SNA的社会化标注系统标签资源聚合研究,孙中秋;陈晓美;周姗姗;,吉林大学管理学院;,2014
商业银行个人客户特征身份的识别——基于Logistic模型的研究,关志新;刘寅;王秋雯;,中国工商银行产品研发中心数据挖掘团队;中国工商银行产品研发中心;,2014
消错学理论研究综述,周金革;郭开仲;,广东工业大学管理学院;广州科技职业技术学院;,2014
全月球撞击坑形貌特征的识别与多指标表达,王娇;程维明;周成虎;赵敏;,中国科学院地理科学与资源研究所资源与环境信息系统国家重点实验室;中国科学院大学;,2014
上海市优势与潜力学科分析——基于Scopus数据库的文献计量分析,樊晓杰;王一珉;,复旦大学高等教育研究所;爱思唯尔公司;,2014
企业社交网络对员工流失行为的影响研究,周蓉龄;齐佳音;,北京邮电大学经济管理学院;,2014
E-science环境下学术规范的新领域:科学数据,袁曦临;,东南大学图书馆情报科技研究所;,2014
基于社交网络的个性化知识服务模型研究,杨瑞仙;李露琪;,郑州大学信息管理学院;,2014
网络信息资源知识发现机理研究,叶丽莎;王学东;方婧;,华中师范大学信息管理学院;,2014
基于专利共类的信息与生物技术融合趋势分析,黄鲁成;黄斌;吴菲菲;苗红;,北京工业大学经济与管理学院;,2014
序,刘燕权;,美国南康涅狄格州立大学;美国南康涅狄格州立大学理事会;,2014
数字图书馆中的用户弱信息需求分析及服务策略研究,邝婉玲;,华南师范大学经济与管理学院;,2014
对微博信息流中意见领袖的实证分析:以“厦门BRT公交爆炸案”为个案,禹建强;李艳芳;,北京师范大学文学院;,2014
提升税收数据分析应用能力的关键要素,赵为民;谭荣华;,安徽大学经济学院;中国人民大学财金学院;,2014
基于专利分析的深海水下采油树产业情报研究,张善杰;陆亦恺;陈伟炯;刘晓琴;,上海海事大学科学技术情报研究所;上海海事大学科学研究院;,2014
行业异质性、CO_2排放与政策选择——基于湖北省工业行业面板数据的实证研究,张奋勤;孙永平;余珮;,碳排放权交易湖北省协同创新中心;湖北经济学院;对外经济贸易大学国际经济贸易学院;,2014
燃料电池车专利情报研究——基于Innography专利分析平台,张群;张柏秋;,江南大学图书馆;吉林大学图书馆;,2014
基于MOOCs的多元同心学习分析模型构建,花燕锋;张龙革;,吉林大学高等教育研究所;,2014
《统计研究》的历史阶段性回顾与特征分析,朱建平;刘晓葳;欧阳汉;,厦门大学两岸关系和平发展协同创新中心;厦门大学经济学院;厦门大学数据挖掘研究中心;中国统计学会;教育部高等学校统计学类专业教学指导委员会;中国统计教育学会;厦门大学经济学院统计系;,2014
数据挖掘模型在小企业主信用评分领域的应用,王磊;范超;解明明;,国家统计局国际统计信息中心;中国国际经济交流中心;中国人民大学统计学院;,2014
基于BP神经网络的高校声誉危机预警研究,缪建红;冯俊文;夏子然;周鎏鎏;,南京理工大学经济管理学院;,2014
基于用户需求分析的数字图书馆知识发现系统研究,张为江;,天津图书馆;,2014
基于数据挖掘的图书采购模型研究,宋宇;,南京中医药大学图书馆;,2014
基于访问日志的几类数据挖掘模型体系构建,周文学;王福;,内蒙古工业大学图书馆;,2014
基于Python的微博用户关系挖掘研究,林晓丽;胡可可;胡青;,武汉科技大学计算机科学与技术学院;武汉科技大学城市学院;,2014
面向情报工作的可视化分析系统研究,由凯;钟慧娟;游宏梁;,中国国防科技信息中心;,2014
国内数字图书馆个性化服务研究主题演化分析,孙雨生;仇蓉蓉;黄传慧;方芳;,湖北工业大学管理学院;,2014
知识获取的对数透视原理分析——以数据挖掘领域为例,江雪琴;张志平;李琳娜;,中国科学技术信息研究所;,2014
基于嵌入式技术的知识咨询服务探讨,雒凤军;王兰;,吉林财经大学图书馆;,2014
专利价值评估研究现状及趋势分析,许华斌;成全;,福州大学经济与管理学院;,2014
基于DMC的技术竞争态势分析方法研究,王强;刘志芳;靳晓宏;,北京市科学技术情报研究所、北京市科学技术研究院竞争情报与创新评估重点实验室;北京大学新闻与传播学院;,2014
我国竞争情报搜集研究热点的可视化分析,胡逸宬;陈峰;,中国科学技术信息研究所;,2014
数据新闻:网站专业生产内容(PGC)的可循之途——四大门户网站的数据新闻实践,周善;,广东财经大学人文与传播学院新闻传播系;,2014
国内大豆价格影响因素探讨,沈子曦;王磊1;,上海对外经贸大学商务信息学院;,2014
面向内部威胁的中观信息系统内部控制管理研究,刘国城;杨丽丽;,南京审计学院金审学院;安徽财经大学工商管理学院;,2014
知识型旅游目的地管理平台框架及其构建,乔向杰;张凌云;,北京联合大学旅游学院;,2014
基于旅游数字足迹的西安旅游流网络结构研究,张妍妍;李君轶;杨敏1;,陕西师范大学旅游与环境学院;西安财经学院商学院现代企业研究中心;,2014
流动人口政治参与问题研究,段成荣;段力刚;,中国人民大学;石家庄学院;,2014
基于随机森林的分类器在犯罪预测中的应用研究,孙菲菲;曹卓;肖晓雷;,中国人民公安大学反恐怖学院;中国人民公安大学犯罪学学院;中国人民公安大学侦查学院;,2014
Moodle平台网络课程数据挖掘模式分析,周剑云;,云南普洱学院理工学院;,2014
基于数据挖掘的网络学习行为与学习效果研究,傅钢善1;王改花;,陕西师范大学现代教学技术教育部重点实验室;西安职业技术学院资产处;,2014
基于数据挖掘的高校人才科研能力综合评价方法研究,谭雷;庄新田;韩鹏;,东北大学工商管理学院;东北大学秦皇岛分校人事处;东北大学信息科学与工程学院;,2014
基于数据挖掘的网络广告评判,彭宇翔;来鹏;,南京信息工程大学数学与统计学院;,2014
美国科研信息共享访问生态系统SHARE项目研究及启示,周宇;,河南职业技术学院图书馆;,2014
高校图书馆语义化馆藏资源深度聚合模式及其应用研究,邱均平;方国平;,武汉大学中国科学评价研究中心;武汉大学信息管理学院;,2014
用户在线评论数据挖掘的网商信用度分析,毕达宇;夏晓旭;王婧1;,华中师范大学湖北省电子商务研究中心;华中师范大学信息管理学院;,2014
国内图书馆联盟云计算服务研究现状与问题分析,单伟;陈淑平;,燕山大学图书馆;,2014
信息检索中关于表格信息挖掘技术的研究,刘葳;孙一鸣;,长春理工大学计算机科学技术学院;,2014
一种K-Means改进算法在图书馆主题挖掘中的应用研究,宋楚平;李少芹;,南通纺织职业技术学院;,2014
城市配送研究的新进展,许茂增;余国印;,重庆交通大学管理学院;,2014
商业银行反洗钱信息系统现状及研究进展,毛宇星;张成洪;凌鸿;,复旦大学管理学院;,2014
属性约简的两阶段遗传算法,安利平;刘森;,南开大学商学院;,2014
经济重心与人口重心的时空演变——来自省会城市的证据,倪鹏飞;杨华磊;周晓波;,中国社会科学院城市与竞争力研究中心;中国农业大学经济管理学院;兰州大学经济学院;,2014
Web挖掘技术支持的在线视频学习资源智能化管理——来自VOD的应用实践,李亮;,南通大学现代教育技术中心;,2014
抽样调查中对定性变量之间关联分析的方法选择,张士玉;郝旭光;,北京联合大学管理学院信息管理与电子商务系;对外经济贸易大学国际商学院人力资源系;,2014
关联规则在领域知识推荐中的应用研究,雷雪;侯人华;曾建勋1;,中国科学技术信息研究所;,2014
中小商业银行分析型客户关系管理应用研究,黄金睿;,北京大学光华管理学院;包商银行博士后科研工作站;,2014
学习分析技术的发展和挑战——第四届学习分析与知识国际会议评析,吴永和;曹盼;邢万里;马晓玲;,华东师范大学开放教育学院及上海数字化教育装备工程技术研究中心;华东师范大学教育信息技术学系;密苏里大学哥伦比亚分校信息科学与学习技术系;华东师范大学信息学系;,2014
中国自由贸易区贸易和投资管理制度优化研究:基于粗糙集理论与方法,申远;,南京财经大学应用数学学院;,2014
西安市社区公共体育服务研究,王怡;,西安体育学院;,2014
基于PADClass模型的数字化课堂学习过程数据挖掘与分析研究,方海光;侯伟锋;王晓春;楚云海;,首都师范大学教育技术系;,2014
网络教学平台学生学习行为聚类分析,田娜;陈明选;,江南大学教育技术系;,2014
改进TFIDF算法在潜在合作关系挖掘中的应用研究,孙鸿飞;侯伟锋1;,东北电力大学经济管理学院;,2014
基于共词分析的我国科学数据领域研究主题探析,司莉;李鑫;,武汉大学信息管理学院;,2014
基于Web of Science的中国科学院地球表层系统科学研究机构科研成果的文献计量分析,盛春蕾;李晓明;刘峥;,中国科学院东北地理与农业生态研究所文献信息中心;吉林省经济干部管理学院图书馆;中国科学院文献情报中心;,2014
战略性新兴产业创新系统网络演化及运行模式研究——基于深圳LED产业的分析,张志彤;程跃;银路;,电子科技大学经济与管理学院;广西大学公共管理学院;,2014
媒体信任是否影响我们对转基因食品问题的态度——基于中国网络社会心态调查(2014)的数据,余慧;刘合潇;,上海立信会计学院文法学院;复旦大学新闻学院;,2014
2013年图书馆学期刊问卷调查法文章的总体分析,徐建华;王翩然;李盛楠;,南开大学商学院信息资源管理系;,2014
编辑距离算法在科研基金名称数据分析中的应用,赵胜钢;李军莲;陈颖;,中国医学科学院医学信息研究所;,2014
SOM聚类技术在读者行为分析中的应用,马芳;,烟台工程职业技术学院图书馆;,2014
校园记忆之图书馆生活——基于用户日志挖掘的呈现,汪志莉;张毅;,华东师范大学图书馆;,2014
高校科研机构管理模式探微——基于“三圈理论”,蔺艳娥;,陕西师范大学;陕西广播电视大学;,2014
讨论MPA与MPP教育的不同,张康之;向玉琼;,南京大学服务型政府研究所;南京农业大学公共管理学院;,2014
基于数据驱动平滑检验的密度预测评估方法——以香港恒生指数、上证综指和台湾加权指数为例,张玉鹏;王茜1;,华东师范大学金融与统计学院;上海对外经贸大学WTO学院;,2014
需求驱动的移动商务价值链组织的多阶博弈仿真,危小超;胡斌;聂规划;,华中科技大学管理学院;武汉理工大学经济学院;,2014
基于PPC模型的我国农业循环经济综合评价,单忠纪;翟绪军;黄平平;,黑龙江八一农垦大学经济管理学院;黑龙江八一农垦大学会计学院;,2014
语料库在批评话语分析中的应用,张淑静;,河南师范大学外国语学院;,2014
图书馆在科学数据管理中的角色定位研究,樊俊豪;,上海大学图书情报档案系;,2014
紧抓数据机遇——英国数据能力战略,庆斌;,中国国防科技信息中心;,2014
经济管理中信息技术发挥的优势,赵真玉;,胜利石油管理局高级人才培训中心党校;,2014
模糊证据权法在西藏一江两河流域耕地适宜性评价中的应用,金贵;王占岐;李伟松;胡守庚;张道军;重多;,湖北大学资源环境学院;中国地质大学公共管理学院;地质过程与矿产资源国家重点实验室;西藏国土资源规划开发研究院;,2014
国外科技论文统计与对比分析研究,赵应吉;,重庆科技学院外国语学院;,2014
关联数据驱动的企业信息资源集成研究,陈菁华;吴泱;,华中师范大学信息管理系;,2014
高校图书馆岗位社会化实践及对策研究——基于利益相关者的视角,吴雪芝;,首都师范大学图书馆;,2014
基于EMD的数据驱动模型在径流预测中的应用,赵雪花;陈旭远1;袁旭琦;,太原理工大学水利科学与工程学院;,2014
英语语法引导式数据驱动学习平台的构建与成效,罗凌;温善毅;朱永红;,赣南师范学院外国语学院;上海外国语大学研究生部;江西师范大学传播学院;,2014
在线到移动环境下消费接受行为的演化研究:基于计算实验方法,蒋国银;马费成1;刘行军;,湖北经济学院信息管理学院;武汉大学信息管理学院;,2014
VAR-LiNGAM模型在货币传导机制分析中的应用,郜哲;林长青;,北京大学光华管理学院/北大方正集团科研工作站;,2014
数据驱动型决策研究框架与应用——以电动汽车领域为例,张英杰;张旭明;彭洁;,中国科学技术信息研究所;北京中汽虹图汽车技术开发有限公司;,2014
基于机器学习的寿险精算生命表函数估计,冯颖;周晓剑;,南京理工大学经济管理学院;南京邮电大学管理学院;,2014
基于机器学习的自动文摘研究综述,曹洋;成颖;裴雷;,南京大学信息管理学院;,2014
基于知识图谱的中外自然语言处理研究的对比分析,邱均平1;方国平;,武汉大学中国科学评价研究中心;,2014
基于支持向量机的供应链风险评估研究,舒彤;葛佳丽;陈收;,湖南大学工商管理学院;,2014
产品意见挖掘研究进展,李光敏;张磊;赵登科;,湖北师范学院计算机科学技术学院;河南大学数据与知识工程研究所;郑州经贸职业学院计算机系;,2014
基于支持向量机的突发事件分级研究,商丽媛;谭清美;,南京航空航天大学经济与管理学院;,2014
微博中产品意见挖掘研究,李光敏;许新山;张磊;,湖北师范学院计算机科学技术学院;河南大学数据与知识工程研究所;,2014
基于统计学习理论的支持向量机预测模型,章永来;史海波;周晓锋;杨秀锋;,中国科学院沈阳自动化研究所;中国科学院大学;辽宁工程技术大学;,2014
基于小波支持向量机回归的股票预测,李坤;谭梦羽;,西安财经学院经济学院;西安电子科技大学;,2014
智能学习环境下新涌现技术与学习方式配置模型研究,杨娟;苏菡;黄兴禄;刘洪涛;,四川师范大学计算机科学学院;重庆邮电大学计算机学院;,2014
基于朴素贝叶斯模型的一种网络负面信息预警策略研究,张扬;崔晨阳;,中国人民公安大学;北京大学;,2014
基于内容分析的用户评论质量的评价与预测,聂卉;,中山大学资讯管理系;,2014
在线问答社区信息质量评价研究综述,姜雯;许鑫;,华东师范大学商学院信息学系;,2014
基于社会计算和机器学习的垃圾邮件快速过滤,徐雅斌;李卓;董源;,北京信息科技大学计算机学院;北京信息科技大学 网络文化与数字传播北京市重点实验室;,2014
