题目T1,作者A1,地址AD,年份YR
上海金融动态(2014.10),肖立伟;,NA,2014
社会化投资平台荐股有效性的实证分析——以股360平台荐股为例,宋光辉;邓艳;吴栩;,华南理工大学工商管理学院;,2014
工行积极创新全球现金管理服务,陈轶闻;,NA,2014
大数据政府创新:基于数据流的公共价值创造,赵强;单炜;,南京财经大学公共管理学院;,2014
基于云计算-大数据的价值链创新机制研究,叶春森;梁昌勇;梁雯;,安徽大学商学院;合肥工业大学管理学院;,2014
大数据环境下企业创新机会研究,侯锡林;李天柱;马佳;刘小琴;,辽宁科技大学工商管理学院;,2014
药品安全性突发事件情报分析框架构建,徐绪堪;房道伟;魏建香;,南京大学信息管理学院;河海大学企业管理学院信息管理系;江苏省数据工程与知识服务重点实验室<南京大学>;南京邮电大学物联网学院;,2014
大数据时代的版权与文化,阎晓宏;,国家新闻出版广电总局(国家版权局);,2014
以大数据透视世界杯——2014“世界杯”社交媒体传播分析报告,刘连喜;张腾之;肖频频;,中央电视台发展研究中心;,2014
大数据在电视新闻中的应用:创新、问题与方向——以央视2014年大数据系列报道为例,毛湛文;李瑞阳;,中国人民大学新闻学院;福建师范大学传播学院;,2014
坚持优势互补  不断深化合作  奋力打造现代化政府统计数据来源的双轨,马建堂;,NA,2014
"从“慕课”到“小微课”,看大数据在教学中的应用",杨永林;张世蓉;丁韬;张虹;王娜;,清华大学外文系;兰州理工大学外语学院;中国政法大学外语学院;北京科技大学外语学院;,2014
新技术与电子书包融合构建智慧学习环境的研究,崔惠萍;傅钢善;,西安石油大学;陕西师范大学;,2014
“大数据”理念的教育应用与中国教育改革——从数据分类到证据转化的机遇识别,吴晓威;陈旭远;,东北师范大学教育学部;,2014
大数据与小学数学教育,史宁中;,义务教育数学课程标准修订组;,2014
MOOC在我国高等教育中的发展困境及对策研究,翟雪松;袁婧;,安徽建筑大学外国语学院;中国科学技术大学;安徽三联学院外国语学院;,2014
大数据面面观,何克抗;,北京师范大学教育信息技术协同创新中心;,2014
利益相关者视角的高等教育信息化发展策略研究,杨晓宏;杨方琦;,西北师范大学教育技术学院;渭南师范学院;,2014
网络拓扑特征对病毒式营销传播动态影响的研究——基于新浪微博大数据的实证分析,陆煊;江若尘;,"上海财经大学国际工商管理学院;上海财经大学,上海发展研究院;",2014
欧美传统出版企业大数据应用策略探析,刘银娣;,华南理工大学新闻与传播学院;,2014
融合新闻时代的普利策新闻奖研究,李冰;刘双;,北京交通大学语言与传播学院;,2014
“人机互构”语境下网络新闻编辑模式的转型与创新,华进;,湘潭大学;,2014
大数据重构预测性新闻的向度,陈雪奇;王人立;,四川大学文学与新闻学院;,2014
数据论文:大数据时代新兴学术论文出版类型探讨,刘凤红;崔金钟;韩芳桥;刘国俊;,中国科学院植物研究所文献与信息管理中心;,2014
“微目标”在美国政治广告中的应用研究,刘亚琼;,中国人民大学马克思主义学院;,2014
大数据背景下广告运作转型分析,邓若伊;罗玉婷;,重庆工商大学文学与新闻学院;重庆工商大学文化产业研究院;中国新闻史学会传媒教育实践基地;,2014
大数据、云计算技术对审计的影响研究,秦荣生;,北京国家会计学院;,2014
导言  泛在知识环境下图书馆知识发现技术与应用研究,张计龙;,复旦大学图书馆;,2014
图书馆大数据监护系统的构建——以生命周期理论为视角,马晓亭;,兰州商学院信息工程学院;,2014
国内外数字时代的目录学理论体系研究进展,王锰;陈雅;郑建明;,南京大学信息管理学院;,2014
大数据环境下文献传递营销工作的思考,张红莉;,南开大学图书馆;,2014
大数据时代图书馆读者的隐私危机与隐私保护,彭华杰;,河南省图书馆;,2014
大数据时代图书馆个性化智慧服务QOS保障研究,马晓亭;,兰州商学院信息工程学院;,2014
我国图书情报领域大数据研究趋势探讨,于雪;,吉林省图书馆;,2014
国外网络信息存档研究述评,冯湘君;,南开大学商学院信息资源管理系;,2014
大数据在反恐情报工作中的应用研究,李本先;张薇;梅建明;凌云翔;,武警警官学院;国防科学技术大学军信系;陕西省科学技术信息研究所;中国人民公安大学反恐怖学院;,2014
大数据应用的误区、风险与优势,胡小明;,中国信息协会;,2014
广东广播电视台影视频道大数据战略实践,祝高;刘大卫;,广东广播电视台影视频道;,2014
聚焦大数据时代的文化与版权  第七届中国版权年会在京举办,高方;,NA,2014
大数据时代科技期刊发展变革断想,贾晓青;王淑华1;,中国地质大学期刊社;,2014
粤港澳物流协同发展若干问题,张滨;陶章;刘小军;,吉林大学;澳门科技大学;,2014
大数据时代商业模式变革契机,李富1;,无锡商业职业技术学院;,2014
大数据环境下网络消费者行为研究,朱光婷;朱君璇;,上海工程技术大学管理学院;,2014
数据驱动的城市规划新技术:从GIS到大数据,李苗裔;王鹏;,"日本金泽大学环境设计学院;北京清华同衡规划设计研究院有限公司,科研与信息中心;",2014
规划转型:基于中关村科学城协作规划的思考,杜宝东;董博;周婧楠;,NA,2014
大数据在中国智慧城市规划中的应用探索,柴彦威;龙瀛1;申悦;,北京大学城市与环境学院;北京市城市规划设计研究院;华东师范大学中国现代城市研究中心;,2014
基于时空间行为的人本导向的智慧城市规划与管理,柴彦威;申悦;陈梓烽;,北京大学城市与环境学院城市与经济地理系;华东师范大学中国现代城市研究中心;北京大学城市与环境学院;,2014
大数据在智慧城市研究与规划中的应用,甄峰;秦萧;,南京大学建筑与城市规划学院;南京大学地理与海洋科学学院;,2014
大数据在城市规划中的应用:来自北京市城市规划设计研究院的思考与实践,茅明睿;,北京市城市规划设计研究院规划信息中心;,2014
新书推介,林嘉颖;,同济大学城市规划系;,2014
智慧城市与城市规划——基于各种空间尺度的实践分析,王鹏1;杜竞强;,北京清华同衡规划设计研究院科研与信息中心;北京清华同衡规划设计研究院智慧城市研究所;,2014
大数据·存在论·儒学现代性,陈迎年;,华东理工大学人文科学研究院;,2014
网络空间战略互动与决策逻辑,任琳;,中国社会科学院世界经济与政治研究所;,2014
筑牢我国大数据管理的安全防线,常小兵;,中国联合网络通信集团有限公司;,2014
中国基层安全治理的数据挖掘与风险预警机制研究,蔡一军;,上海政法学院刑事司法学院;,2014
统计学专业学生大数据分析能力的培养方式选择,张海波;黄世祥;,中南财经政法大学统计与数学学院;,2014
多元价值、大数据与决策不确定性的应对策略,谢新水;,南京大学政府管理学院;,2014
生态文明、大数据与财务成本管理创新——中国会计学会财务成本分会2014学术年会综述,王泽霞;江乾坤;叶继英;,杭州电子科技大学会计学院;,2014
大数据背景下企业营销战略再分析与营销策略新内涵,王其和;,湖北工业大学工程技术学院;,2014
中国本土组织的家庭隐喻及网络治理机制——基于泛家族主义的视角,胡国栋;,东北财经大学工商管理学院;,2014
城乡规划管理与政策,赵蔚1;,NA,2014
大数据改变新闻价值的三个维度,陈雪奇;王昱力;,四川大学文学与新闻学院;,2014
基于文献计量的我国大数据研究进展分析,侯元元;黄裕荣;张红莉1;吕华侨;,北京市科学技术情报研究所;,2014
大数据技术:提高互联网治理主动性的利器,苗国厚;谢霄男;,重庆交通大学思想政治理论课教学科研部;电子科技大学马克思主义教育学院;,2014
大模型:城市和区域研究的新范式,龙瀛2;吴康;王江浩;刘行健;,"北京市城市规划设计研究院,北京城市实验室;首都经济贸易大学城市经济与公共管理学院;中国科学院地理科学与资源研究所;香港大学建筑学院城市规划与设计系;",2014
基于手机数据识别上海中心城的城市空间结构,钮心毅;丁亮;宋小冬;,"同济大学建筑与城市规划学院,高密度人居环境生态与节能教育部重点实验室;同济大学建筑与城市规划学院;",2014
大数据驱动的管理与决策前沿课题,徐宗本;冯芷艳;郭迅华;曾大军;陈国青;,西安交通大学;国家自然科学基金委员会管理科学学部;清华大学经济管理学院;中国科学院自动化研究所;,2014
大数据时代学术期刊的变革及编辑工作的转型,邵玉娴;,国家气候中心;《气候变化研究进展》编辑部;,2014
全媒体时代的特点及其对学术期刊编辑的要求,高庆华;,北京航天情报与信息研究所《系统工程与电子技术》编辑部;,2014
基于本体的网络购物客户知识表示建模,黄天柱;袁迎松;,陕西科技大学管理学院;,2014
大数据对新媒体图景的展示——以英国电视短剧《黑镜2:马上回来》为例,卞波;曹蔚;,南京艺术学院传媒学院;,2014
大数据时代背景下的高等美术院校财务管理研究,金如会;陈燕芹;,NA,2014
新时期农村现代远程教育的发展研究,费明明;赵乐华;任毅;,中国地质大学(北京)继续教育学院;,2014
数字图书馆的“大数据”,曾建勋;,NA,2014
基于大数据的用户阅读行为分析,徐飞;徐绪堪1;吴广印;,江苏省广电有线信息网络股份有限公司;河海大学信息管理系;中国科学技术信息研究所;,2014
访北京大学信息管理系主任李广建教授,刘锦山;,北京雷速科技有限公司;,2014
基于大数据的网络空间安全战略的构建,李留英;,南京政治学院上海校区军事信息管理系;,2014
社会化媒体下的信息安全技术研究,张思龙;,南京政治学院上海校区军事信息管理系;,2014
基于图书馆业务的信息安全管理平台,李留英;,南京政治学院上海校区军事信息管理系;,2014
碎片化科研创新点动态挖掘研究,温有奎;吴广印;,北京万方软件股份有限公司;中国科学技术信息研究所;,2014
国际大数据研究主题的可视化分析,王一博;郭鑫;王继民;,北方工业大学信息工程学院计算机系;北京大学信息管理系;,2014
面向大数据的网络安全策略研究,郑晨阳;,南京政治学院上海校区军事信息管理系;,2014
大数据环境下网络安全态势感知研究,曹蓉蓉;,南京政治学院上海校区军事信息管理系;,2014
数据驱动的科学工作流及其在生物医学中的应用实践,洪娜;钱庆;方安;吴思竹;杨林;,中国医学科学院医学信息研究所;,2014
大数据环境下知识表示与知识组织方法应用,王曰芬;傅柱;,南京理工大学经济管理学院信息管理系;,2014
大数据时代数字资源整合与聚合研究,陈晓美;孙中秋;王秀艳;周珊珊;,吉林大学管理学院;中国建设银行股份有限公司松原分行;,2014
地区性文献信息资源共享和联合服务的可持续发展研究,李苗苗;张薇;李鹏飞2;任佳妮;周立秋;,陕西省科学技术信息研究所;,2014
2013年出版产业十大关键词解读,肖东发;卞卓舟;,北京大学现代出版研究所;北京外语教学与研究出版社市场部;,2014
社会化媒体时代的舆论研究:概念、议题与创新,周葆华;,复旦大学新闻学院;复旦大学传媒与舆情调查中心;,2014
社交媒体时代的网络舆情——生态变化及舆情研究现状、趋势,李彪;郑满宁;,中国人民大学新闻学院;中国人民大学新闻与社会发展研究中心;,2014
社交媒体环境中编辑力的开发,周琳达;沈阳;,武汉大学信息管理学院;,2014
媒体融合背景下视听媒体创新途径再分析,高宪春;解葳;,江苏师范大学传媒与影视学院;济宁学院;,2014
论高校智慧图书馆的功能与构建,谢芳;,广东文艺职业学院图书馆;,2014
协同创新理念下的图书馆与教学共赢共促——广东部分高职院校教师教学信息需求调查与解析,金泽龙;,广东轻工职业技术学院图书馆;,2014
MCMC方法的发展与现代贝叶斯的复兴——纪念贝叶斯定理发现250周年,刘乐平;高磊;杨娜;,天津财经大学统计学系;,2014
面向信息特征模式识别的核方法研究综述,黄炜;刘坤;,湖北工业大学管理学院;武汉理工大学管理学院;,2014
基于动态能力的CDRS知识整合模型研究,袁红军;,郑州师范学院图书馆;,2014
互联网金融与小微企业融资模式创新研究,徐洁;隗斌贤;揭筱纹;,四川大学商学院;浙江省科学技术协会;,2014
大数据时代的色彩调和论研究,郑晓红;,苏州大学;,2014
基于汽车的城市智能化公共信息服务设计,张茫茫;傅江;,清华大学美术学院;北京理工大学软件学院;,2014
分布式产品数据采集动态任务调度模型研究,余凡;程虹;王超;余红伟;许伟;,武汉大学质量发展战略研究院;,2014
新媒体研究,陈徇;,NA,2014
促进云外包服务业发展的思路与策略,戴军;王霞;,同济大学经济与管理学院;苏州工业园区服务外包职业学院;,2014
构建重庆市一体化环保物联网,罗庆俊;游波;,重庆市环境保护信息中心;,2014
电视剧能靠大数据“算”出来吗,方毅华;,中国传媒大学新闻学院;,2014
非传统安全的缘起、话语变迁及治理体系,曾润喜;毛子骏;徐晓林;,华中科技大学公共管理学院;华中科技大学非传统安全研究中心;,2014
基于用户体验的政府网站绩效评估:探索与实践,王璟璇;杨道玲;,国家信息中心信息化研究部;,2014
从“技术导向”到“学习导向”——信息技术支持的学与教变革国际发展新动向,周晓清;汪晓东;刘鲜;李琼;焦建利1;,华南师范大学未来教育研究中心;红河学院工学院;,2014
开放教育资源与教学改革国际研讨会5月在浙江大学召开,紫金;,NA,2014
量化投资的发展及其监管,郭喜才;,华东政法大学金融创新与风险管理研究所;,2014
学习技术典型案例:从社交机器人到大脑刺激——学习科学国际大会“学习技术”专题综述,徐光涛;张怀浩;任友群;,华东师范大学教育信息技术学系;,2014
认知·态度·行动——“2014全国两会”传播效果评析,张勤;,华北电力大学人文学院;,2014
机器学习在中文期刊论文自动分类研究中的应用,王昊;叶鹏;邓三鸿;,南京大学信息管理学院;,2014
面向知识服务的双库协同知识库框架结构研究,蒋勋;徐绪堪2;苏新宁;,南京大学信息管理学院;无锡城市职业技术学院电子信息系;,2014
网络舆情传播阶段与模型比较研究,曾润喜;王晨曦;陈强1;,华中科技大学公共管理学院;,2014
图书情报学视角下Web挖掘研究述评,张兴旺2;黄晓斌;,桂林理工大学图书馆;中山大学资讯管理学院;,2014
电视媒体转型关键因素研究——基于战略地图的视角,严威;潘玮;王梓霖;,中国传媒大学经济与管理学院;无锡广播电视集团组织人事处;中国人民大学;,2014
主持人语,李云;,NA,2014
数据驱动的设计模式之变,王巍;,湖南大学设计艺术学院;,2014
论“素质教育舞蹈课”的综合性特征,彭红;,北京舞蹈学院;,2014
从PISA2012测评数据看我国教育,唐盛昌;,上海市基础教育国际课程比较研究所;,2014
IT第三平台对开放教育资源建设的影响,梁小庆;,中央广播电视大学音像出版社;,2014
中国媒介环境学现状研究,郑燕;陈静;,山东大学历史文化学院;浙江宁波出版社;,2014
网络时代综艺节目创作思路转型,冯宗泽;,中国传媒大学教务处;,2014
众筹出版运营机制探析,张书勤;,北京印刷学院;,2014
复杂云计算环境下基于客户感知价值的数字图书馆服务效能评估,马晓亭;,兰州商学院信息工程学院;,2014
浅谈全媒体环境下版权管理和交易,李登清;李佺;许玲;,湖北广播电视台;华中师范大学;,2014
浪潮与沙滩:略谈图书情报研究热点和研究前沿,叶鹰;,南京大学信息管理学院;,2014
数字社会记忆资源跨机构聚合机制研究,赵生辉;朱学芳;,南京大学信息管理学院;,2014
互联网金融:城商行的挑战与机遇,冼国明;石庆芳;,南开大学跨国公司研究中心;南开大学经济学院;,2014
财务共享服务中心模式探究,黄庆华;杜舟;段万春;杨鑫;,昆明理工大学管理与经济学院;北京工商大学嘉华学院财务与管理系;,2014
从MOOC到SPOC——基于加州大学伯克利分校和清华大学MOOC实践的学术对话,徐葳;贾永政;阿曼多·福克斯;戴维·帕特森;,清华大学交叉信息研究院;加州大学伯克利分校;,2014
教育信息技术创新应用与协同发展——解读2013教育技术国际论坛,张洪孟;胡凡刚;谢坤;,曲阜师范大学信息技术与传播学院;,2014
3D打印对物流产业的影响及对策创新,金玉然;戢守峰;李天柱;董晓东;刘小琴;,东北大学工商管理学院;辽宁科技大学工商管理学院;,2014
新媒体视域下我国出版物标识的分析与启示,陈志文;,上海出版印刷高等专科学校;南京大学出版研究院;,2014
专利信息方法在寻找合作伙伴中的应用,卞志昕;,上海图书馆上海科学技术情报研究所;,2014
站在新起点  实现新突破——重报集团联手北大方正打造全媒体“样板工程”,李栋;崔健;,NA,2014
重庆日报报业集团争做全国数字出版转型的排头兵,熊明;,《重庆日报》;,2014
物流企业主动改进、双边关系绩效与客户忠诚度——基于双边调查的实证研究,孙晓波;骆温平;,上海海事大学;,2014
网络化制造的研究框架与未来主题,柴国荣;赵雷;宗胜亮;,兰州大学管理学院;,2014
大数据时代的媒体版权定价,王梦珏;严威;,中国传媒大学经济与管理学院;,2014
以法务为主导的电视版权管理模式新探,刘星1;,湖南广播电视台;,2014
推进国家与社会治理法治化现代化,徐汉明;,中南财经政法大学法治发展与司法改革研究中心;湖北法治发展战略研究院;,2014
基于“计算思维”能力培养的教学改革探索与实践,王移芝;金一;周围;,北京交通大学计算机与信息技术学院;,2014
促进人人、时时、处处的泛在学习——上海开放大学服务学习型城市建设的实践探索,蒋红;,上海开放大学;,2014
高校图书馆网络资源采选推送策略研究,杨敏;吉萍;原小玲;,太原科技大学图书馆;,2014
大数据时代出版业“商业生态”构建路径探析,程忠良1;,安庆师范学院教育学院;,2014
地方出版社的坚守与超越——以贵州地区出版社为案例的分析,杨毅;,武汉大学文学院;,2014
由原始记忆走向智慧记忆——论档案记忆功能的历史演变及其未来趋势,杨智勇;,上海大学图书情报档案系;,2014
我国旅游研究20年(1993—2013年)——基于NSSFC旅游项目反映的学术态势,李经龙;付吉娟;,安徽大学商学院旅游管理系;,2014
基于加权深度的异常曲线探测方法——以空气质量函数型数据为例,黄恒君;,兰州商学院统计学院;兰州商学院甘肃省经济发展数量分析研究中心;,2014
对专利信息利用困境的思考及对策探析——以构建专利数据开放平台为视角,于大伟;,国家知识产权局;,2014
从《联合国2014年电子政务调查报告》看全球政府数据公开,丁艺;,国家行政学院电子政务研究中心;,2014
云计算背景下欧盟消费者个人敏感数据的法律保护,鞠晔;王平;,北京联合大学应用文理学院;,2014
越走越宽的统计心路,杨洪;,北京环境卫生工程集团有限公司;,2014
新时期高校科研信息化建设工作思考,宋阳;,哈尔滨工程大学;,2014
电商新趋势下影响网络消费者购买行为因素研究,孙永波;刘晓敏;,北京工商大学商学院;,2014
高等教育信息化影响因素及对策研究,江婕;卢晓勇;,南昌大学管理科学与工程系;南昌大学现代教育技术中心;,2014
图书类电子商务网站上的个性化推荐应用研究,肖倩;董占山;张聪;,北京印刷学院;,2014
公民科研的兴起及图书馆的角色,黄敏聪;,广东省科技图书馆;广东省科技图书馆情报研究部;,2014
基于官产学研的竞争情报战略联盟研究,曹如中;代婷婷;郭华;,上海工程技术大学管理学院;上海工程技术大学图书馆;,2014
浅析央视《“两会”大数据》的数据新闻报道,张楠2;,湖北第二师范学院文学院新闻系;,2014
新媒体时代电视消亡论与影响论探微,胡言会;石长顺;,华中科技大学新闻与信息传播学院;川北医学院人文社科学院;,2014
动静结合的城市社区图书馆服务规划概论,曲哲;,广州大学图书馆;,2014
云服务定价机制探索研究,林晓伟;郑丽娟;,闽南师范大学管理学院;,2014
首届(2014)中国城市发展与产业经济学术年会会议综述,蒋荷新;,上海师范大学商学院;,2014
美国电视剧《纸牌屋》所引发的思考,陈旸;王卓;,中国传媒大学艺术学部戏剧影视学院;,2014
中国社会经济统计学的发展和怎样发展,杨映霜;,中国统计出版社;,2014
基于互联网金融框架的科技金融创新及发展机制研究,李运河;,商丘师范学院经济与管理学院;商丘师范学院豫鲁苏皖结合区经济社会发展研究中心;,2014
区间符号数据在股市特征中的实证分析,安宁;孟洁;,中央财经大学统计与数学学院;,2014
儿童受父母体罚现状研究——基于对第三期中国妇女社会地位调查数据的分析,和建花;,全国妇联妇女研究所;,2014
试水数字技术课堂——江苏省南通一中数字化智慧校园建设,成锦平;,江苏省南通市第一中学;,2014
阅读疾病:从身体到数字,陈琰娇;,南开大学文学院;,2014
移动互联网视阈下群体性事件的网络舆情变化研究,范叶妮;,重庆工商大学文学与新闻学院;,2014
略论新信息时代高校图书馆创新服务及馆员素养,高晓晶;罗雪梅;,电子科技大学图书馆;电子科技大学多媒体学习中心;,2014
让移动互联网思维在图书馆落地,牛现云;刘术华;,国家图书馆;,2014
数字化时代世界传媒经济研究的新转向——与罗伯特·G·皮卡德教授的座谈会对话录,罗伯特·G·皮卡德;喻国明;李慧娟;,牛津大学路透研究所;中国人民大学新闻与社会发展研究中心;中国人民大学新闻学院;,2014
虚拟货币:运行机制、交易体系与治理策略,祁明;肖林;,华南理工大学经济与贸易学院;,2014
《冲击与应对——互联网金融冲击下中小商业银行的应对策略研究》,许创强;,NA,2014
图书馆2.0创新服务平台探究——以“常州电视图书馆”服务平台建设为例,梅耀国;钱舒屏;张炜;,常州市图书馆;国家图书馆;,2014
促进主题词表的社会应用,周晓英;,NA,2014
基于知识发现的读者决策采购研究,刘军;金淑娜;,信阳师范学院图书馆;,2014
数据挖掘在期刊客户关系管理中的应用,周松;,四川大学文学与新闻学院;西南政法大学全球新闻传播学院;,2014
文献发现荐购系统的框架设计与功能研究,解金兰;张洪艳;,天津农学院图书馆;,2014
Kaas知识即服务:面向读者需求的分层知识服务模型及实践,刘军;金淑娜;,信阳师范学院图书馆;信阳师范学院文献信息研究所;,2014
2000-2010年国外竞争情报研究述评,黄汝群;,闽西职业技术学院图书馆;,2014
吉林省生物制药产业竞争环境与竞争策略研究,王伟;潘玮1;于跃;,吉林大学公共卫生学院医学信息学系;,2014
PISA测评的政策意蕴,陈法宝;李学书;,上海师范大学国际与比较教育研究中心;上海开放大学发展研究部;,2014
主题式学科化服务模式研究——结合海南大学图书馆的案例分析,覃丽金;吉家凡;唐朝胜;刘小香;邓玲;,海南大学图书馆;海南大学图书馆参考咨询部;海南大学信息科学技术学院;海南大学图书馆文献检索教研室;,2014
高职大学生学情分析的实证研究,戴小红;,浙江金融职业学院国际商务系;,2014
可穿戴设备交互设计研究,孙效华;冯泽西;,同济大学设计创意学院;,2014
面向产业集群的数据挖掘推荐系统研究与设计,薛中玉;李春梅;杨思维;,安徽京诺科技发展有限公司;北京中机科海科技发展有限公司;,2014
基于应对等级的突发事件网络舆情热度分析,曹学艳;张仙;刘樑;方宽;段飞飞;李仕明;,电子科技大学经济与管理学院;,2014
数据挖掘技术在现代远程开放教育组织CRM系统中的应用,吴艳华;张少杰;阎佳;,吉林大学管理学院;长春广播电视大学财经系;,2014
基于内容相似性的科技论文网络的构建及其属性的初步分析,潘现伟;杨颖;崔雷;,中国医科大学医学信息学系;中国医科大学图书馆;,2014
